{
  "tool": "semantic-diff",
  "version": 1,
  "left": {
    "label": "fixtures/python/rename/before"
  },
  "right": {
    "label": "fixtures/python/rename/after"
  },
  "summary": "renamed `foo` to `bar` (3 call sites and 1 import updated); renamed `Cart.cost` to `Cart.price` (1 call site updated)",
  "summaryLines": [
    "renamed `foo` to `bar` (3 call sites and 1 import updated)",
    "renamed `Cart.cost` to `Cart.price` (1 call site updated)"
  ],
  "stats": {
    "operations": 2,
    "byKind": {
      "rename": 2
    },
    "formattingOnlyFiles": 0,
    "filesCompared": 2,
    "filesChanged": 2
  },
  "operations": [
    {
      "kind": "rename",
      "symbolKind": "function",
      "from": {
        "name": "foo",
        "qualifiedName": "foo",
        "kind": "function",
        "file": "math.py",
        "span": {
          "start": {
            "line": 1,
            "column": 1
          },
          "end": {
            "line": 3,
            "column": 20
          }
        }
      },
      "to": {
        "name": "bar",
        "qualifiedName": "bar",
        "kind": "function",
        "file": "math.py",
        "span": {
          "start": {
            "line": 1,
            "column": 1
          },
          "end": {
            "line": 3,
            "column": 20
          }
        }
      },
      "callSitesUpdated": 3,
      "importsUpdated": 1,
      "confidence": 0.98
    },
    {
      "kind": "rename",
      "symbolKind": "method",
      "from": {
        "name": "cost",
        "qualifiedName": "Cart.cost",
        "kind": "method",
        "file": "math.py",
        "span": {
          "start": {
            "line": 7,
            "column": 5
          },
          "end": {
            "line": 9,
            "column": 27
          }
        }
      },
      "to": {
        "name": "price",
        "qualifiedName": "Cart.price",
        "kind": "method",
        "file": "math.py",
        "span": {
          "start": {
            "line": 7,
            "column": 5
          },
          "end": {
            "line": 9,
            "column": 27
          }
        }
      },
      "callSitesUpdated": 1,
      "importsUpdated": 0,
      "confidence": 0.98
    }
  ],
  "ignoredFormatting": [],
  "files": [
    {
      "path": "app.py",
      "status": "modified",
      "language": "python"
    },
    {
      "path": "math.py",
      "status": "modified",
      "language": "python"
    }
  ],
  "parseDiagnostics": [],
  "highlights": [
    {
      "opIndex": 0,
      "side": "left",
      "file": "math.py",
      "span": {
        "start": {
          "line": 1,
          "column": 1
        },
        "end": {
          "line": 3,
          "column": 20
        }
      },
      "kind": "rename"
    },
    {
      "opIndex": 0,
      "side": "right",
      "file": "math.py",
      "span": {
        "start": {
          "line": 1,
          "column": 1
        },
        "end": {
          "line": 3,
          "column": 20
        }
      },
      "kind": "rename"
    },
    {
      "opIndex": 1,
      "side": "left",
      "file": "math.py",
      "span": {
        "start": {
          "line": 7,
          "column": 5
        },
        "end": {
          "line": 9,
          "column": 27
        }
      },
      "kind": "rename"
    },
    {
      "opIndex": 1,
      "side": "right",
      "file": "math.py",
      "span": {
        "start": {
          "line": 7,
          "column": 5
        },
        "end": {
          "line": 9,
          "column": 27
        }
      },
      "kind": "rename"
    }
  ],
  "sources": {
    "left": {
      "app.py": "from math import Cart, foo\n\n\ndef run(x: int) -> int:\n    cart = Cart()\n    a = foo(x)\n    b = foo(a)\n    return foo(b) + cart.cost(b)\n",
      "math.py": "def foo(n: int) -> int:\n    base = n * 2\n    return base + 1\n\n\nclass Cart:\n    def cost(self, n: int) -> int:\n        tax = 1\n        return n * 2 + tax\n"
    },
    "right": {
      "app.py": "from math import Cart, bar\n\n\ndef run(x: int) -> int:\n    cart = Cart()\n    a = bar(x)\n    b = bar(a)\n    return bar(b) + cart.price(b)\n",
      "math.py": "def bar(n: int) -> int:\n    base = n * 2\n    return base + 1\n\n\nclass Cart:\n    def price(self, n: int) -> int:\n        tax = 1\n        return n * 2 + tax\n"
    }
  }
}
