{
  "tool": "semantic-diff",
  "version": 1,
  "left": {
    "label": "fixtures/typescript/logic-with-formatting/before"
  },
  "right": {
    "label": "fixtures/typescript/logic-with-formatting/after"
  },
  "summary": "edited `shipping` (2 updates)",
  "summaryLines": [
    "edited `shipping` (2 updates)"
  ],
  "stats": {
    "operations": 1,
    "byKind": {
      "logic-edit": 1
    },
    "formattingOnlyFiles": 0,
    "filesCompared": 1,
    "filesChanged": 1
  },
  "operations": [
    {
      "kind": "logic-edit",
      "symbol": {
        "name": "shipping",
        "qualifiedName": "shipping",
        "kind": "function",
        "file": "src/shipping.ts",
        "span": {
          "start": {
            "line": 1,
            "column": 8
          },
          "end": {
            "line": 10,
            "column": 2
          }
        }
      },
      "before": {
        "name": "shipping",
        "qualifiedName": "shipping",
        "kind": "function",
        "file": "src/shipping.ts",
        "span": {
          "start": {
            "line": 1,
            "column": 8
          },
          "end": {
            "line": 7,
            "column": 2
          }
        }
      },
      "edits": [
        {
          "op": "update",
          "nodeType": "number",
          "before": {
            "span": {
              "start": {
                "line": 3,
                "column": 15
              },
              "end": {
                "line": 3,
                "column": 17
              }
            },
            "text": "50"
          },
          "after": {
            "span": {
              "start": {
                "line": 5,
                "column": 15
              },
              "end": {
                "line": 5,
                "column": 17
              }
            },
            "text": "75"
          }
        },
        {
          "op": "update",
          "nodeType": "number",
          "before": {
            "span": {
              "start": {
                "line": 6,
                "column": 26
              },
              "end": {
                "line": 6,
                "column": 27
              }
            },
            "text": "2"
          },
          "after": {
            "span": {
              "start": {
                "line": 9,
                "column": 26
              },
              "end": {
                "line": 9,
                "column": 27
              }
            },
            "text": "3"
          }
        }
      ],
      "confidence": 0.9
    }
  ],
  "ignoredFormatting": [],
  "files": [
    {
      "path": "src/shipping.ts",
      "status": "modified",
      "language": "typescript"
    }
  ],
  "parseDiagnostics": [],
  "highlights": [
    {
      "opIndex": 0,
      "side": "left",
      "file": "src/shipping.ts",
      "span": {
        "start": {
          "line": 3,
          "column": 15
        },
        "end": {
          "line": 3,
          "column": 17
        }
      },
      "kind": "logic-edit"
    },
    {
      "opIndex": 0,
      "side": "right",
      "file": "src/shipping.ts",
      "span": {
        "start": {
          "line": 5,
          "column": 15
        },
        "end": {
          "line": 5,
          "column": 17
        }
      },
      "kind": "logic-edit"
    },
    {
      "opIndex": 0,
      "side": "left",
      "file": "src/shipping.ts",
      "span": {
        "start": {
          "line": 6,
          "column": 26
        },
        "end": {
          "line": 6,
          "column": 27
        }
      },
      "kind": "logic-edit"
    },
    {
      "opIndex": 0,
      "side": "right",
      "file": "src/shipping.ts",
      "span": {
        "start": {
          "line": 9,
          "column": 26
        },
        "end": {
          "line": 9,
          "column": 27
        }
      },
      "kind": "logic-edit"
    }
  ],
  "sources": {
    "left": {
      "src/shipping.ts": "export function shipping(total: number, weight: number): number {\n  const base = 5;\n  if (total > 50) {\n    return 0;\n  }\n  return base + weight * 2;\n}\n"
    },
    "right": {
      "src/shipping.ts": "export function shipping(total: number, weight: number): number {\n  const base = 5;\n\n  // free shipping threshold\n  if (total > 75) {\n    return 0;\n  }\n\n  return base + weight * 3;\n}\n"
    }
  }
}
