{
  "tool": "semantic-diff",
  "version": 1,
  "left": {
    "label": "fixtures/python/mixed/before"
  },
  "right": {
    "label": "fixtures/python/mixed/after"
  },
  "summary": "renamed `foo` to `bar` (2 call sites and 1 import updated); extracted `parse_header` from `read_file`",
  "summaryLines": [
    "renamed `foo` to `bar` (2 call sites and 1 import updated)",
    "extracted `parse_header` from `read_file`"
  ],
  "stats": {
    "operations": 2,
    "byKind": {
      "rename": 1,
      "extract": 1
    },
    "formattingOnlyFiles": 0,
    "filesCompared": 3,
    "filesChanged": 3
  },
  "operations": [
    {
      "kind": "rename",
      "symbolKind": "function",
      "from": {
        "name": "foo",
        "qualifiedName": "foo",
        "kind": "function",
        "file": "math.py",
        "span": {
          "start": {
            "line": 1,
            "column": 1
          },
          "end": {
            "line": 3,
            "column": 20
          }
        }
      },
      "to": {
        "name": "bar",
        "qualifiedName": "bar",
        "kind": "function",
        "file": "math.py",
        "span": {
          "start": {
            "line": 1,
            "column": 1
          },
          "end": {
            "line": 3,
            "column": 20
          }
        }
      },
      "callSitesUpdated": 2,
      "importsUpdated": 1,
      "confidence": 0.98
    },
    {
      "kind": "extract",
      "source": {
        "name": "read_file",
        "qualifiedName": "read_file",
        "kind": "function",
        "file": "reader.py",
        "span": {
          "start": {
            "line": 1,
            "column": 1
          },
          "end": {
            "line": 7,
            "column": 18
          }
        }
      },
      "host": {
        "name": "read_file",
        "qualifiedName": "read_file",
        "kind": "function",
        "file": "reader.py",
        "span": {
          "start": {
            "line": 9,
            "column": 1
          },
          "end": {
            "line": 11,
            "column": 30
          }
        }
      },
      "extracted": {
        "name": "parse_header",
        "qualifiedName": "parse_header",
        "kind": "function",
        "file": "reader.py",
        "span": {
          "start": {
            "line": 1,
            "column": 1
          },
          "end": {
            "line": 6,
            "column": 18
          }
        }
      },
      "confidence": 0.91
    }
  ],
  "ignoredFormatting": [],
  "files": [
    {
      "path": "app.py",
      "status": "modified",
      "language": "python"
    },
    {
      "path": "math.py",
      "status": "modified",
      "language": "python"
    },
    {
      "path": "reader.py",
      "status": "modified",
      "language": "python"
    }
  ],
  "parseDiagnostics": [],
  "highlights": [
    {
      "opIndex": 0,
      "side": "left",
      "file": "math.py",
      "span": {
        "start": {
          "line": 1,
          "column": 1
        },
        "end": {
          "line": 3,
          "column": 20
        }
      },
      "kind": "rename"
    },
    {
      "opIndex": 0,
      "side": "right",
      "file": "math.py",
      "span": {
        "start": {
          "line": 1,
          "column": 1
        },
        "end": {
          "line": 3,
          "column": 20
        }
      },
      "kind": "rename"
    },
    {
      "opIndex": 1,
      "side": "left",
      "file": "reader.py",
      "span": {
        "start": {
          "line": 1,
          "column": 1
        },
        "end": {
          "line": 7,
          "column": 18
        }
      },
      "kind": "extract"
    },
    {
      "opIndex": 1,
      "side": "right",
      "file": "reader.py",
      "span": {
        "start": {
          "line": 9,
          "column": 1
        },
        "end": {
          "line": 11,
          "column": 30
        }
      },
      "kind": "extract"
    },
    {
      "opIndex": 1,
      "side": "right",
      "file": "reader.py",
      "span": {
        "start": {
          "line": 1,
          "column": 1
        },
        "end": {
          "line": 6,
          "column": 18
        }
      },
      "kind": "extract"
    }
  ],
  "sources": {
    "left": {
      "app.py": "from math import foo\n\n\ndef run(x: int) -> int:\n    a = foo(x)\n    return foo(a)\n",
      "math.py": "def foo(n: int) -> int:\n    base = n * 2\n    return base + 1\n",
      "reader.py": "def read_file(path: str) -> str:\n    text = open(path, encoding=\"utf-8\").read()\n    lines = text.split(\"\\n\")\n    header = lines[0].strip() if lines else \"\"\n    if len(header) == 0:\n        raise ValueError(\"missing header\")\n    return header\n"
    },
    "right": {
      "app.py": "from math import bar\n\n\ndef run(x: int) -> int:\n    a = bar(x)\n    return bar(a)\n",
      "math.py": "def bar(n: int) -> int:\n    base = n * 2\n    return base + 1\n",
      "reader.py": "def parse_header(text: str) -> str:\n    lines = text.split(\"\\n\")\n    header = lines[0].strip() if lines else \"\"\n    if len(header) == 0:\n        raise ValueError(\"missing header\")\n    return header\n\n\ndef read_file(path: str) -> str:\n    text = open(path, encoding=\"utf-8\").read()\n    return parse_header(text)\n"
    }
  }
}
