{
  "tool": "semantic-diff",
  "version": 1,
  "left": {
    "label": "fixtures/python/extract/before"
  },
  "right": {
    "label": "fixtures/python/extract/after"
  },
  "summary": "extracted `parse_header` from `read_file`",
  "summaryLines": [
    "extracted `parse_header` from `read_file`"
  ],
  "stats": {
    "operations": 1,
    "byKind": {
      "extract": 1
    },
    "formattingOnlyFiles": 0,
    "filesCompared": 1,
    "filesChanged": 1
  },
  "operations": [
    {
      "kind": "extract",
      "source": {
        "name": "read_file",
        "qualifiedName": "read_file",
        "kind": "function",
        "file": "reader.py",
        "span": {
          "start": {
            "line": 1,
            "column": 1
          },
          "end": {
            "line": 7,
            "column": 18
          }
        }
      },
      "host": {
        "name": "read_file",
        "qualifiedName": "read_file",
        "kind": "function",
        "file": "reader.py",
        "span": {
          "start": {
            "line": 9,
            "column": 1
          },
          "end": {
            "line": 11,
            "column": 30
          }
        }
      },
      "extracted": {
        "name": "parse_header",
        "qualifiedName": "parse_header",
        "kind": "function",
        "file": "reader.py",
        "span": {
          "start": {
            "line": 1,
            "column": 1
          },
          "end": {
            "line": 6,
            "column": 18
          }
        }
      },
      "confidence": 0.91
    }
  ],
  "ignoredFormatting": [],
  "files": [
    {
      "path": "reader.py",
      "status": "modified",
      "language": "python"
    }
  ],
  "parseDiagnostics": [],
  "highlights": [
    {
      "opIndex": 0,
      "side": "left",
      "file": "reader.py",
      "span": {
        "start": {
          "line": 1,
          "column": 1
        },
        "end": {
          "line": 7,
          "column": 18
        }
      },
      "kind": "extract"
    },
    {
      "opIndex": 0,
      "side": "right",
      "file": "reader.py",
      "span": {
        "start": {
          "line": 9,
          "column": 1
        },
        "end": {
          "line": 11,
          "column": 30
        }
      },
      "kind": "extract"
    },
    {
      "opIndex": 0,
      "side": "right",
      "file": "reader.py",
      "span": {
        "start": {
          "line": 1,
          "column": 1
        },
        "end": {
          "line": 6,
          "column": 18
        }
      },
      "kind": "extract"
    }
  ],
  "sources": {
    "left": {
      "reader.py": "def read_file(path: str) -> str:\n    text = open(path, encoding=\"utf-8\").read()\n    lines = text.split(\"\\n\")\n    header = lines[0].strip() if lines else \"\"\n    if len(header) == 0:\n        raise ValueError(\"missing header\")\n    return header\n"
    },
    "right": {
      "reader.py": "def parse_header(text: str) -> str:\n    lines = text.split(\"\\n\")\n    header = lines[0].strip() if lines else \"\"\n    if len(header) == 0:\n        raise ValueError(\"missing header\")\n    return header\n\n\ndef read_file(path: str) -> str:\n    text = open(path, encoding=\"utf-8\").read()\n    return parse_header(text)\n"
    }
  }
}
