{
  "tool": "semantic-diff",
  "version": 1,
  "left": {
    "label": "fixtures/python/reorder/before"
  },
  "right": {
    "label": "fixtures/python/reorder/after"
  },
  "summary": "reordered symbols in `module.py` (`beta`, `alpha`, `Bag` → `alpha`, `beta`, `Bag`); reordered methods of `Bag` in `module.py` (`second`, `first` → `first`, `second`)",
  "summaryLines": [
    "reordered symbols in `module.py` (`beta`, `alpha`, `Bag` → `alpha`, `beta`, `Bag`)",
    "reordered methods of `Bag` in `module.py` (`second`, `first` → `first`, `second`)"
  ],
  "stats": {
    "operations": 2,
    "byKind": {
      "reorder": 2
    },
    "formattingOnlyFiles": 0,
    "filesCompared": 1,
    "filesChanged": 1
  },
  "operations": [
    {
      "kind": "reorder",
      "scope": "file",
      "file": "module.py",
      "before": [
        {
          "name": "beta",
          "qualifiedName": "beta",
          "span": {
            "start": {
              "line": 1,
              "column": 1
            },
            "end": {
              "line": 3,
              "column": 17
            }
          }
        },
        {
          "name": "alpha",
          "qualifiedName": "alpha",
          "span": {
            "start": {
              "line": 6,
              "column": 1
            },
            "end": {
              "line": 8,
              "column": 17
            }
          }
        },
        {
          "name": "Bag",
          "qualifiedName": "Bag",
          "span": {
            "start": {
              "line": 11,
              "column": 1
            },
            "end": {
              "line": 18,
              "column": 21
            }
          }
        }
      ],
      "after": [
        {
          "name": "alpha",
          "qualifiedName": "alpha",
          "span": {
            "start": {
              "line": 1,
              "column": 1
            },
            "end": {
              "line": 3,
              "column": 17
            }
          }
        },
        {
          "name": "beta",
          "qualifiedName": "beta",
          "span": {
            "start": {
              "line": 6,
              "column": 1
            },
            "end": {
              "line": 8,
              "column": 17
            }
          }
        },
        {
          "name": "Bag",
          "qualifiedName": "Bag",
          "span": {
            "start": {
              "line": 11,
              "column": 1
            },
            "end": {
              "line": 18,
              "column": 21
            }
          }
        }
      ],
      "confidence": 0.93
    },
    {
      "kind": "reorder",
      "scope": "class",
      "file": "module.py",
      "container": "Bag",
      "before": [
        {
          "name": "second",
          "qualifiedName": "Bag.second",
          "span": {
            "start": {
              "line": 12,
              "column": 5
            },
            "end": {
              "line": 14,
              "column": 21
            }
          }
        },
        {
          "name": "first",
          "qualifiedName": "Bag.first",
          "span": {
            "start": {
              "line": 16,
              "column": 5
            },
            "end": {
              "line": 18,
              "column": 21
            }
          }
        }
      ],
      "after": [
        {
          "name": "first",
          "qualifiedName": "Bag.first",
          "span": {
            "start": {
              "line": 12,
              "column": 5
            },
            "end": {
              "line": 14,
              "column": 21
            }
          }
        },
        {
          "name": "second",
          "qualifiedName": "Bag.second",
          "span": {
            "start": {
              "line": 16,
              "column": 5
            },
            "end": {
              "line": 18,
              "column": 21
            }
          }
        }
      ],
      "confidence": 0.93
    }
  ],
  "ignoredFormatting": [],
  "files": [
    {
      "path": "module.py",
      "status": "modified",
      "language": "python"
    }
  ],
  "parseDiagnostics": [],
  "highlights": [
    {
      "opIndex": 0,
      "side": "left",
      "file": "module.py",
      "span": {
        "start": {
          "line": 1,
          "column": 1
        },
        "end": {
          "line": 3,
          "column": 17
        }
      },
      "kind": "reorder"
    },
    {
      "opIndex": 0,
      "side": "left",
      "file": "module.py",
      "span": {
        "start": {
          "line": 6,
          "column": 1
        },
        "end": {
          "line": 8,
          "column": 17
        }
      },
      "kind": "reorder"
    },
    {
      "opIndex": 0,
      "side": "left",
      "file": "module.py",
      "span": {
        "start": {
          "line": 11,
          "column": 1
        },
        "end": {
          "line": 18,
          "column": 21
        }
      },
      "kind": "reorder"
    },
    {
      "opIndex": 0,
      "side": "right",
      "file": "module.py",
      "span": {
        "start": {
          "line": 1,
          "column": 1
        },
        "end": {
          "line": 3,
          "column": 17
        }
      },
      "kind": "reorder"
    },
    {
      "opIndex": 0,
      "side": "right",
      "file": "module.py",
      "span": {
        "start": {
          "line": 6,
          "column": 1
        },
        "end": {
          "line": 8,
          "column": 17
        }
      },
      "kind": "reorder"
    },
    {
      "opIndex": 0,
      "side": "right",
      "file": "module.py",
      "span": {
        "start": {
          "line": 11,
          "column": 1
        },
        "end": {
          "line": 18,
          "column": 21
        }
      },
      "kind": "reorder"
    },
    {
      "opIndex": 1,
      "side": "left",
      "file": "module.py",
      "span": {
        "start": {
          "line": 12,
          "column": 5
        },
        "end": {
          "line": 14,
          "column": 21
        }
      },
      "kind": "reorder"
    },
    {
      "opIndex": 1,
      "side": "left",
      "file": "module.py",
      "span": {
        "start": {
          "line": 16,
          "column": 5
        },
        "end": {
          "line": 18,
          "column": 21
        }
      },
      "kind": "reorder"
    },
    {
      "opIndex": 1,
      "side": "right",
      "file": "module.py",
      "span": {
        "start": {
          "line": 12,
          "column": 5
        },
        "end": {
          "line": 14,
          "column": 21
        }
      },
      "kind": "reorder"
    },
    {
      "opIndex": 1,
      "side": "right",
      "file": "module.py",
      "span": {
        "start": {
          "line": 16,
          "column": 5
        },
        "end": {
          "line": 18,
          "column": 21
        }
      },
      "kind": "reorder"
    }
  ],
  "sources": {
    "left": {
      "module.py": "def beta(n: int) -> int:\n    value = n + 2\n    return value\n\n\ndef alpha(n: int) -> int:\n    value = n + 1\n    return value\n\n\nclass Bag:\n    def second(self) -> int:\n        value = 2\n        return value\n\n    def first(self) -> int:\n        value = 1\n        return value\n"
    },
    "right": {
      "module.py": "def alpha(n: int) -> int:\n    value = n + 1\n    return value\n\n\ndef beta(n: int) -> int:\n    value = n + 2\n    return value\n\n\nclass Bag:\n    def first(self) -> int:\n        value = 1\n        return value\n\n    def second(self) -> int:\n        value = 2\n        return value\n"
    }
  }
}
